{
  "collection_id": "metatrader_mt4_vs_mt5",
  "domain": "metatrader",
  "title": "موتور تفاوت متاتریدر ۴ و ۵",
  "description": "تفاوت‌های تأییدشدنی بین دو پلتفرم. هیچ رویه‌ای نباید بدون تعیین دامنه‌ی پلتفرم پاسخ داده شود.",
  "version": "v001",
  "generated_at": "2026-09-05T12:13:09Z",
  "pipeline_stage": "STRUCTURED",
  "source_files": [
    "tools/seed_metatrader.py"
  ],
  "notes": [
    "نمونه‌ی اول (sample-first) — پیش از تولید انبوه باید ساختار و صحت تأیید شود.",
    "همه‌ی رکوردها PENDING_VERIFICATION هستند و باید با مستندات رسمی MetaQuotes تطبیق داده شوند."
  ],
  "objects": [
    {
      "id": "MT-CMP-0001",
      "object_type": "COMPARISON",
      "domain": "metatrader",
      "title": "تفاوت انواع سفارش معلق در متاتریدر ۴ و ۵",
      "language": "fa-en",
      "chunk_text": "متاتریدر ۴ چهار نوع سفارش معلق دارد و متاتریدر ۵ شش نوع؛ دو نوع Stop Limit فقط در متاتریدر ۵ موجود است.",
      "source": {
        "source_type": "MODEL_DRAFT",
        "source_ref": "tools/seed_metatrader.py",
        "source_location": "MT-CMP-0001"
      },
      "authority_level": "GENERAL_KNOWLEDGE",
      "methodology_scope": "PLATFORM_OPERATION",
      "platform_scope": "VERSION_DEPENDENT",
      "approval_status": "PENDING_VERIFICATION",
      "lifecycle_status": "PENDING_REVIEW",
      "verification_required": true,
      "verification_note": "نوشته‌شده بر پایه‌ی دانش عمومی از پلتفرم، بدون دسترسی به مستندات رسمی MetaQuotes (شبکه‌ی خروجی در محیط پردازش مسدود بود). مسیر منوها، پیام‌های خطا و محدودیت‌ها باید با راهنمای رسمی و بیلد فعلی پلتفرم تطبیق داده شود.",
      "confidence": 0.85,
      "version": "v001",
      "created_at": "2026-09-05T12:13:09Z",
      "updated_at": "2026-09-05T12:13:09Z",
      "category": "تفاوت متاتریدر ۴ و ۵",
      "comparison": {
        "mt4": "Buy Limit, Sell Limit, Buy Stop, Sell Stop (۴ نوع)",
        "mt5": "Buy Limit, Sell Limit, Buy Stop, Sell Stop, Buy Stop Limit, Sell Stop Limit (۶ نوع)"
      },
      "keywords": [
        "pending order",
        "stop limit",
        "تفاوت"
      ],
      "related_questions": [
        "فرق سفارش‌های متاتریدر ۴ و ۵ چیه؟",
        "Buy Stop Limit توی متاتریدر ۴ هست؟"
      ]
    },
    {
      "id": "MT-CMP-0002",
      "object_type": "COMPARISON",
      "domain": "metatrader",
      "title": "تفاوت حسابداری پوزیشن (Netting / Hedging)",
      "language": "fa-en",
      "chunk_text": "متاتریدر ۴ فقط Hedging است، اما متاتریدر ۵ بسته به نوع حسابی که بروکر می‌سازد می‌تواند Netting یا Hedging باشد.",
      "source": {
        "source_type": "MODEL_DRAFT",
        "source_ref": "tools/seed_metatrader.py",
        "source_location": "MT-CMP-0002"
      },
      "authority_level": "GENERAL_KNOWLEDGE",
      "methodology_scope": "PLATFORM_OPERATION",
      "platform_scope": "VERSION_DEPENDENT",
      "approval_status": "PENDING_VERIFICATION",
      "lifecycle_status": "PENDING_REVIEW",
      "verification_required": true,
      "verification_note": "نوشته‌شده بر پایه‌ی دانش عمومی از پلتفرم، بدون دسترسی به مستندات رسمی MetaQuotes (شبکه‌ی خروجی در محیط پردازش مسدود بود). مسیر منوها، پیام‌های خطا و محدودیت‌ها باید با راهنمای رسمی و بیلد فعلی پلتفرم تطبیق داده شود.",
      "confidence": 0.85,
      "version": "v001",
      "created_at": "2026-09-05T12:13:09Z",
      "updated_at": "2026-09-05T12:13:09Z",
      "category": "تفاوت متاتریدر ۴ و ۵",
      "comparison": {
        "mt4": "فقط Hedging؛ هر سفارش یک تیکت مستقل.",
        "mt5": "Netting یا Hedging، وابسته به نوع حساب تعیین‌شده توسط بروکر."
      },
      "keywords": [
        "netting",
        "hedging"
      ],
      "related_questions": [
        "چرا توی متاتریدر ۵ معامله‌هام ادغام می‌شن؟"
      ]
    },
    {
      "id": "MT-CMP-0003",
      "object_type": "COMPARISON",
      "domain": "metatrader",
      "title": "تفاوت تعداد تایم‌فریم‌ها",
      "language": "fa-en",
      "chunk_text": "متاتریدر ۵ تایم‌فریم‌های به‌مراتب بیشتری نسبت به متاتریدر ۴ ارائه می‌دهد.",
      "source": {
        "source_type": "MODEL_DRAFT",
        "source_ref": "tools/seed_metatrader.py",
        "source_location": "MT-CMP-0003"
      },
      "authority_level": "GENERAL_KNOWLEDGE",
      "methodology_scope": "PLATFORM_OPERATION",
      "platform_scope": "VERSION_DEPENDENT",
      "approval_status": "PENDING_VERIFICATION",
      "lifecycle_status": "PENDING_REVIEW",
      "verification_required": true,
      "verification_note": "نوشته‌شده بر پایه‌ی دانش عمومی از پلتفرم، بدون دسترسی به مستندات رسمی MetaQuotes (شبکه‌ی خروجی در محیط پردازش مسدود بود). مسیر منوها، پیام‌های خطا و محدودیت‌ها باید با راهنمای رسمی و بیلد فعلی پلتفرم تطبیق داده شود.",
      "confidence": 0.8,
      "version": "v001",
      "created_at": "2026-09-05T12:13:09Z",
      "updated_at": "2026-09-05T12:13:09Z",
      "category": "تفاوت متاتریدر ۴ و ۵",
      "comparison": {
        "mt4": "۹ تایم‌فریم (M1, M5, M15, M30, H1, H4, D1, W1, MN1)",
        "mt5": "۲۱ تایم‌فریم، شامل M2, M3, M4, M6, M10, M12, M20, H2, H3, H6, H8, H12"
      },
      "keywords": [
        "timeframe",
        "تایم فریم"
      ],
      "related_questions": [
        "چرا تایم‌فریم H2 ندارم؟",
        "متاتریدر ۵ چند تایم‌فریم داره؟"
      ]
    },
    {
      "id": "MT-CMP-0004",
      "object_type": "COMPARISON",
      "domain": "metatrader",
      "title": "ناسازگاری اکسپرت‌ها و اندیکاتورها (MQL4 و MQL5)",
      "language": "fa-en",
      "chunk_text": "زبان برنامه‌نویسی دو پلتفرم متفاوت است و فایل‌های اکسپرت یا اندیکاتور یکی روی دیگری اجرا نمی‌شوند؛ برای هر پلتفرم باید نسخه‌ی مخصوص همان پلتفرم تهیه شود.",
      "source": {
        "source_type": "MODEL_DRAFT",
        "source_ref": "tools/seed_metatrader.py",
        "source_location": "MT-CMP-0004"
      },
      "authority_level": "GENERAL_KNOWLEDGE",
      "methodology_scope": "PLATFORM_OPERATION",
      "platform_scope": "VERSION_DEPENDENT",
      "approval_status": "PENDING_VERIFICATION",
      "lifecycle_status": "PENDING_REVIEW",
      "verification_required": true,
      "verification_note": "نوشته‌شده بر پایه‌ی دانش عمومی از پلتفرم، بدون دسترسی به مستندات رسمی MetaQuotes (شبکه‌ی خروجی در محیط پردازش مسدود بود). مسیر منوها، پیام‌های خطا و محدودیت‌ها باید با راهنمای رسمی و بیلد فعلی پلتفرم تطبیق داده شود.",
      "confidence": 0.9,
      "version": "v001",
      "created_at": "2026-09-05T12:13:09Z",
      "updated_at": "2026-09-05T12:13:09Z",
      "category": "تفاوت متاتریدر ۴ و ۵",
      "comparison": {
        "mt4": "MQL4؛ فایل‌های ex4 در پوشه‌ی MQL4.",
        "mt5": "MQL5؛ فایل‌های ex5 در پوشه‌ی MQL5."
      },
      "keywords": [
        "MQL4",
        "MQL5",
        "ex4",
        "ex5"
      ],
      "related_questions": [
        "اندیکاتور متاتریدر ۴ رو توی ۵ نصب کنم؟",
        "چرا اکسپرتم اجرا نمی‌شه؟"
      ]
    },
    {
      "id": "MT-CMP-0005",
      "object_type": "COMPARISON",
      "domain": "metatrader",
      "title": "تفاوت تستر استراتژی",
      "language": "fa-en",
      "chunk_text": "تستر استراتژی متاتریدر ۵ چندنمادی و چندرشته‌ای است و امکان تست با تیک‌های واقعی را دارد؛ تستر متاتریدر ۴ تک‌نمادی و تک‌رشته‌ای است.",
      "source": {
        "source_type": "MODEL_DRAFT",
        "source_ref": "tools/seed_metatrader.py",
        "source_location": "MT-CMP-0005"
      },
      "authority_level": "GENERAL_KNOWLEDGE",
      "methodology_scope": "PLATFORM_OPERATION",
      "platform_scope": "VERSION_DEPENDENT",
      "approval_status": "PENDING_VERIFICATION",
      "lifecycle_status": "PENDING_REVIEW",
      "verification_required": true,
      "verification_note": "نوشته‌شده بر پایه‌ی دانش عمومی از پلتفرم، بدون دسترسی به مستندات رسمی MetaQuotes (شبکه‌ی خروجی در محیط پردازش مسدود بود). مسیر منوها، پیام‌های خطا و محدودیت‌ها باید با راهنمای رسمی و بیلد فعلی پلتفرم تطبیق داده شود.",
      "confidence": 0.8,
      "version": "v001",
      "created_at": "2026-09-05T12:13:09Z",
      "updated_at": "2026-09-05T12:13:09Z",
      "category": "تفاوت متاتریدر ۴ و ۵",
      "comparison": {
        "mt4": "تست تک‌نمادی، بدون پردازش موازی.",
        "mt5": "تست چندنمادی، پردازش موازی و بهینه‌سازی پیشرفته با تیک واقعی."
      },
      "keywords": [
        "strategy tester",
        "backtest",
        "optimization"
      ],
      "related_questions": [
        "بک‌تست کدوم پلتفرم بهتره؟"
      ]
    },
    {
      "id": "MT-CMP-0006",
      "object_type": "COMPARISON",
      "domain": "metatrader",
      "title": "عمق بازار و تقویم اقتصادی داخلی",
      "language": "fa-en",
      "chunk_text": "عمق بازار (Depth of Market) و تقویم اقتصادی داخلی از قابلیت‌های متاتریدر ۵ هستند و در متاتریدر ۴ وجود ندارند.",
      "source": {
        "source_type": "MODEL_DRAFT",
        "source_ref": "tools/seed_metatrader.py",
        "source_location": "MT-CMP-0006"
      },
      "authority_level": "GENERAL_KNOWLEDGE",
      "methodology_scope": "PLATFORM_OPERATION",
      "platform_scope": "VERSION_DEPENDENT",
      "approval_status": "PENDING_VERIFICATION",
      "lifecycle_status": "PENDING_REVIEW",
      "verification_required": true,
      "verification_note": "نوشته‌شده بر پایه‌ی دانش عمومی از پلتفرم، بدون دسترسی به مستندات رسمی MetaQuotes (شبکه‌ی خروجی در محیط پردازش مسدود بود). مسیر منوها، پیام‌های خطا و محدودیت‌ها باید با راهنمای رسمی و بیلد فعلی پلتفرم تطبیق داده شود.",
      "confidence": 0.75,
      "version": "v001",
      "created_at": "2026-09-05T12:13:09Z",
      "updated_at": "2026-09-05T12:13:09Z",
      "category": "تفاوت متاتریدر ۴ و ۵",
      "comparison": {
        "mt4": "بدون Depth of Market و بدون تقویم اقتصادی داخلی.",
        "mt5": "دارای Depth of Market و تقویم اقتصادی داخلی (نمایش داده‌ها وابسته به بروکر است)."
      },
      "keywords": [
        "depth of market",
        "economic calendar"
      ],
      "related_questions": [
        "تقویم اقتصادی متاتریدر کجاست؟"
      ]
    }
  ]
}
