{
  "collection_id": "review_queue_open_items",
  "domain": "meta",
  "title": "صف بازبینی انسانی",
  "description": "مواردی که برای ادامه‌ی کار به تصمیم یا داده‌ی انسانی نیاز دارند.",
  "version": "v001",
  "generated_at": "2026-09-05T13:27:46Z",
  "pipeline_stage": "VALIDATED",
  "source_files": [
    "MENTORAI_KB_AUDIT.md"
  ],
  "notes": [
    "اولویت P0 یعنی کار بدون آن متوقف می‌شود."
  ],
  "objects": [
    {
      "id": "RQ-0001",
      "title": "محتوای دوره‌های آکادمی در مخزن موجود نیست",
      "domain": "academy",
      "object_ids": [],
      "reason": "مخزن فقط شامل وب‌سایت آکادمی است؛ هیچ ترنسکریپت، جزوه یا سند متدولوژی وجود ندارد.",
      "question_for_human": "محتوای دوره‌ی مقدماتی و پیشرفته را در چه قالبی و از چه مسیری در اختیار پروژه می‌گذارید؟",
      "options": [
        "آپلود فایل‌های متنی/زیرنویس در raw_sources/academy/",
        "آپلود فایل صوتی و انجام تبدیل گفتار به متن در همین پروژه",
        "دسترسی به پنل دانشجویی برای استخراج محتوا"
      ],
      "recommendation": "فایل‌های متنی یا زیرنویس (SRT/VTT/DOCX) در raw_sources/academy/ قرار بگیرد؛ سریع‌ترین و دقیق‌ترین مسیر است.",
      "priority": "P0",
      "status": "OPEN",
      "created_at": "2026-09-05T13:27:46Z",
      "updated_at": "2026-09-05T13:27:46Z"
    },
    {
      "id": "RQ-0002",
      "title": "دیتاست پرسش و پاسخ منتور موجود نیست",
      "domain": "mentor_qa",
      "object_ids": [],
      "reason": "بدون گفت‌وگوهای واقعی دانشجو و منتور، لایه‌ی MENTOR_QA قابل ساخت نیست.",
      "question_for_human": "خروجی گفت‌وگوهای دانشجو-منتور از چه بستری و با چه قالبی قابل ارائه است؟",
      "options": [
        "خروجی JSON/CSV از تلگرام یا واتس‌اپ",
        "خروجی تیکت‌های پشتیبانی",
        "کپی دستی نمونه‌ی اولیه (۱۰۰ گفت‌وگو)"
      ],
      "recommendation": "ابتدا یک نمونه‌ی ۱۰۰ گفت‌وگویی برای اثبات خط پردازش، سپس خروجی کامل.",
      "priority": "P0",
      "status": "OPEN",
      "created_at": "2026-09-05T13:27:46Z",
      "updated_at": "2026-09-05T13:27:46Z"
    },
    {
      "id": "RQ-0003",
      "title": "دوره‌ی روان‌شناسی آکادمی دریافت نشده است",
      "domain": "psychology",
      "object_ids": [],
      "reason": "لایه‌ی روان‌شناسی فعلاً فقط دانش عمومی است و منبع اصلی آکادمی ندارد.",
      "question_for_human": "دوره‌ی روان‌شناسی آکادمی موجود است؟ در چه قالبی می‌توان آن را دریافت کرد؟",
      "options": [
        "فایل دوره موجود است و ارسال می‌شود",
        "دوره هنوز تولید نشده است"
      ],
      "recommendation": "تا زمان دریافت، لایه‌ی عمومی به‌عنوان موقت و PENDING_VERIFICATION باقی می‌ماند.",
      "priority": "P1",
      "status": "OPEN",
      "created_at": "2026-09-05T13:27:46Z",
      "updated_at": "2026-09-05T13:27:46Z"
    },
    {
      "id": "RQ-0004",
      "title": "بروکر یا بروکرهای مورد استفاده مشخص نیستند",
      "domain": "brokers",
      "object_ids": [],
      "reason": "دانش بروکر بدون نام بروکر و مستندات رسمی آن قابل تولید نیست و هرگز تعمیم داده نمی‌شود.",
      "question_for_human": "دانشجویان آکادمی عمدتاً با کدام بروکر(ها) کار می‌کنند و مستندات رسمی آن‌ها کجاست؟",
      "options": [
        "فهرست بروکرهای پیشنهادی آکادمی ارائه شود",
        "فقط دانش عمومی پلتفرم پوشش داده شود"
      ],
      "recommendation": "فهرست بروکرها + لینک یا فایل مشخصات نمادها؛ بدون آن، سؤال‌های «اسپرد چقدره؟» بی‌پاسخ می‌مانند.",
      "priority": "P1",
      "status": "OPEN",
      "created_at": "2026-09-05T13:27:46Z",
      "updated_at": "2026-09-05T13:27:46Z"
    },
    {
      "id": "RQ-0005",
      "title": "احتمال نمونه/دمو بودن محتوای سایت",
      "domain": "academy",
      "object_ids": [
        "ACA-CAT-0001",
        "CONF-0001"
      ],
      "reason": "هیچ فایل صوتی بارگذاری نشده و آمار بازدید و مدت‌زمان‌ها گرد و تأییدنشده‌اند.",
      "question_for_human": "آیا فهرست فعلی پادکست‌ها و کتاب‌ها واقعی است یا داده‌ی نمونه برای طراحی سایت؟",
      "options": [
        "واقعی است و فایل‌ها بعداً آپلود می‌شوند",
        "داده‌ی نمونه است و باید از پایگاه دانش حذف شود"
      ],
      "recommendation": "تا تعیین تکلیف، این رکوردها PENDING_REVIEW می‌مانند و مربی نباید آن‌ها را قطعی اعلام کند.",
      "priority": "P1",
      "status": "OPEN",
      "created_at": "2026-09-05T13:27:46Z",
      "updated_at": "2026-09-05T13:27:46Z"
    },
    {
      "id": "RQ-0006",
      "title": "شرایط و قیمت منتورینگ مشخص نیست",
      "domain": "academy",
      "object_ids": [
        "ACA-OPS-0002"
      ],
      "reason": "سایت فقط سرفصل خدمات منتورینگ را دارد؛ قیمت، مدت و شرایط ثبت‌نام موجود نیست.",
      "question_for_human": "قیمت، مدت دوره، ظرفیت و شرایط ثبت‌نام منتورینگ چیست؟",
      "options": [
        "اطلاعات ارائه شود تا وارد دانش عملیاتی شود",
        "مربی این سؤال‌ها را به پشتیبانی انسانی ارجاع دهد"
      ],
      "recommendation": "اگر قیمت متغیر است، بهتر است مربی همیشه به پشتیبانی انسانی ارجاع دهد.",
      "priority": "P1",
      "status": "OPEN",
      "created_at": "2026-09-05T13:27:46Z",
      "updated_at": "2026-09-05T13:27:46Z"
    },
    {
      "id": "RQ-0007",
      "title": "دانش متاتریدر ساخته شد اما تأیید نشده است",
      "domain": "metatrader",
      "object_ids": [],
      "reason": "دامنه‌ی متاتریدر با ۹۳ رکورد و پوشش ۴۶ موضوع تکمیل شد، اما محیط پردازش دسترسی شبکه ندارد و مستندات رسمی متاکوتس قابل واکشی نبود؛ بنابراین هیچ رکوردی وضعیت APPROVED ندارد.",
      "question_for_human": "کدام مسیر برای تأیید دانش متاتریدر ترجیح داده می‌شود؟",
      "options": [
        "بازبینی انسانی توسط منتور بر اساس گزارش پوشش (exports/metatrader/mt_coverage_*.md)",
        "قرار دادن نسخه‌ی آفلاین راهنمای متاکوتس در raw_sources/platform/",
        "فعال کردن دسترسی شبکه برای دامنه‌ی metaquotes در محیط پردازش"
      ],
      "recommendation": "بازبینی منتور روی ۲۰ رکورد پرکاربرد (ورود، سفارش، حد ضرر، خطاهای رایج) و سپس تأیید تدریجی بقیه.",
      "priority": "P1",
      "status": "OPEN",
      "created_at": "2026-09-05T13:27:46Z",
      "updated_at": "2026-09-05T13:27:46Z"
    },
    {
      "id": "RQ-0008",
      "title": "متدولوژی رسمی آکادمی تعریف نشده است",
      "domain": "academy",
      "object_ids": [],
      "reason": "عنوان پادکست‌ها به «پرایس اکشن» و «تحلیل تکنیکال» اشاره دارد، اما هیچ سند رسمی متدولوژی وجود ندارد؛ بدون آن، مرز «آکادمی» و «دانش عمومی» قابل اجرا نیست.",
      "question_for_human": "متدولوژی رسمی آکادمی چیست و چه چیزهایی صراحتاً بیرون از آن است؟",
      "options": [
        "سند متدولوژی ارائه شود",
        "متدولوژی از دل ترنسکریپت دوره‌ها استخراج و برای تأیید ارسال شود"
      ],
      "recommendation": "استخراج پیش‌نویس متدولوژی از ترنسکریپت‌ها و تأیید نهایی توسط سبحان صمدی.",
      "priority": "P0",
      "status": "OPEN",
      "created_at": "2026-09-05T13:27:46Z",
      "updated_at": "2026-09-05T13:27:46Z"
    },
    {
      "id": "RQ-0009",
      "title": "پلتفرم اصلی دانشجویان مشخص نیست",
      "domain": "metatrader",
      "object_ids": [
        "ACA-RULE-0001"
      ],
      "reason": "دانش متاتریدر ۴ و ۵ به‌صورت جدا نگهداری می‌شود و مربی باید بداند پاسخ پیش‌فرض را بر مبنای کدام پلتفرم بدهد، وگرنه باید در هر پاسخ از دانشجو بپرسد.",
      "question_for_human": "دانشجویان آکادمی بیشتر از متاتریدر ۴ استفاده می‌کنند یا ۵؟",
      "options": [
        "عمدتاً متاتریدر ۵",
        "عمدتاً متاتریدر ۴",
        "هر دو تقریباً برابر؛ مربی همیشه بپرسد"
      ],
      "recommendation": "اگر یکی غالب است، همان پلتفرم پیش‌فرض شود و تفاوت‌ها فقط هنگام نیاز مطرح شوند.",
      "priority": "P2",
      "status": "CLOSED",
      "created_at": "2026-09-05T13:27:46Z",
      "updated_at": "2026-09-05T13:27:46Z",
      "answer": "هر دو پلتفرم استفاده می‌شوند و هیچ‌کدام پیش‌فرض نیست. مربی باید ابتدا بپرسد متاتریدر ۴ یا ۵ و سپس پاسخ همان پلتفرم را بدهد. ثبت‌شده در تصمیم D-0001 و قاعده‌ی ACA-RULE-0001."
    },
    {
      "id": "RQ-0010",
      "title": "سیاست آکادمی درباره‌ی اکسپرت و کپی‌تریدینگ مشخص نیست",
      "domain": "metatrader",
      "object_ids": [
        "ACA-RULE-0002",
        "ACA-RULE-0003"
      ],
      "reason": "سؤال‌های «کدوم اکسپرت رو بخرم؟» و «کپی‌تریدینگ خوبه؟» پرتکرارند، اما موضع آکادمی درباره‌ی MetaTrader Market، Signals و معامله‌ی خودکار مشخص نیست.",
      "question_for_human": "مربی در برابر سؤال درباره‌ی خرید اکسپرت یا کپی‌تریدینگ چه پاسخی بدهد؟",
      "options": [
        "توضیح فنی بدهد اما توصیه نکند",
        "به‌کلی منع کند و به روش آکادمی برگرداند",
        "به پشتیبانی انسانی ارجاع دهد"
      ],
      "recommendation": "توضیح فنی بدون توصیه‌ی خرید، به‌همراه هشدار ریسک و بازگرداندن به چارچوب آکادمی.",
      "priority": "P2",
      "status": "CLOSED",
      "created_at": "2026-09-05T13:27:46Z",
      "updated_at": "2026-09-05T13:27:46Z",
      "answer": "آکادمی هیچ اکسپرت، سیگنال یا کپی‌تریدینگی پیشنهاد نمی‌کند و این پرسش‌ها به پشتیبانی انسانی ارجاع داده می‌شوند. توضیح فنی نصب و اجرای اکسپرت همچنان مجاز است. ثبت‌شده در تصمیم D-0002 و قواعد ACA-RULE-0002 و ACA-RULE-0003."
    },
    {
      "id": "RQ-0011",
      "title": "متن و مسیر ارجاع در موقعیت‌های حساس روانی تأیید نشده است",
      "domain": "psychology",
      "object_ids": [
        "PSY-RULE-0001"
      ],
      "reason": "لایه‌ی روان‌شناسی باید مرزی داشته باشد که در آن مربی متوقف شود و به انسان ارجاع دهد (نشانه‌های بحران، از دست رفتن کل سرمایه‌ی زندگی، بدهی سنگین). پیش‌نویس این قاعده ساخته شده اما تأیید نشده است.",
      "question_for_human": "متن پاسخ مربی و مسیر ارجاع در این موقعیت‌ها چه باشد؟",
      "options": [
        "متن پیشنهادی PSY-RULE-0001 تأیید شود",
        "متن اختصاصی آکادمی جایگزین شود",
        "ارجاع به شماره یا کانال پشتیبانی مشخص اضافه شود"
      ],
      "recommendation": "تأیید متن پیشنهادی به‌همراه افزودن مسیر تماس دقیق پشتیبانی؛ تا آن زمان رفتار امن پیش‌فرض، ارجاع فوری است.",
      "priority": "P1",
      "status": "OPEN",
      "created_at": "2026-09-05T13:27:46Z",
      "updated_at": "2026-09-05T13:27:46Z"
    }
  ]
}
