{
  "collection_id": "conflict_registry",
  "domain": "meta",
  "title": "دفتر ثبت تعارض‌ها",
  "description": "تعارض‌های کشف‌شده بین منابع. هیچ تعارضی با حدس حل نمی‌شود.",
  "version": "v001",
  "generated_at": "2026-09-05T12:13:09Z",
  "pipeline_stage": "VALIDATED",
  "source_files": [
    "index.html",
    "js/data.js"
  ],
  "notes": [
    "تعارض‌های مربوط به متدولوژی، پس از دریافت محتوای دوره‌ها اضافه خواهند شد."
  ],
  "objects": [
    {
      "id": "CONF-0001",
      "topic": "حجم واقعی محتوای صوتی منتشرشده‌ی آکادمی",
      "domain": "academy",
      "side_a": {
        "object_id_or_source": "index.html:64 (آمار سایت)",
        "statement": "سایت آکادمی «+۸۰ ساعت محتوا» را اعلام می‌کند.",
        "authority_level": "ACADEMY_DERIVED"
      },
      "side_b": {
        "object_id_or_source": "js/data.js (window.SSAData.podcasts[*].src و books[*].src)",
        "statement": "هیچ‌کدام از ۶ پادکست و ۶ کتاب صوتی فایل صوتی بارگذاری‌شده ندارند (src خالی است).",
        "authority_level": "ACADEMY_DERIVED"
      },
      "possible_explanation": "محتوای فعلی سایت احتمالاً داده‌ی نمونه/دمو است و فایل‌های صوتی هنوز آپلود نشده‌اند، یا محتوا در جای دیگری (کانال، پنل دانشجو) منتشر می‌شود.",
      "authority_decision": "",
      "status": "OPEN",
      "requires_human_review": true,
      "review_priority": "P1",
      "impact": "تا روشن شدن این موضوع، مربی هوش مصنوعی نباید به دانشجو بگوید فلان پادکست در سایت قابل پخش است و نباید آمار حجم محتوا را تأیید کند.",
      "created_at": "2026-09-05T12:13:09Z",
      "updated_at": "2026-09-05T12:13:09Z"
    }
  ]
}
