{
  "collection_id": "conflict_registry",
  "domain": "meta",
  "title": "دفتر ثبت تعارض‌ها",
  "description": "تعارض‌های کشف‌شده بین منابع. هیچ تعارضی با حدس حل نمی‌شود.",
  "version": "v001",
  "generated_at": "2026-09-05T15:45:00Z",
  "pipeline_stage": "VALIDATED",
  "source_files": [
    "index.html",
    "js/data.js"
  ],
  "notes": [
    "تعارض‌های مربوط به متدولوژی، پس از دریافت محتوای دوره‌ها اضافه خواهند شد."
  ],
  "objects": [
    {
      "id": "CONF-0001",
      "topic": "حجم واقعی محتوای صوتی منتشرشده‌ی آکادمی",
      "domain": "academy",
      "side_a": {
        "object_id_or_source": "index.html:64 (آمار سایت)",
        "statement": "سایت آکادمی «+۸۰ ساعت محتوا» را اعلام می‌کند.",
        "authority_level": "ACADEMY_DERIVED"
      },
      "side_b": {
        "object_id_or_source": "js/data.js (window.SSAData.podcasts[*].src و books[*].src)",
        "statement": "هیچ‌کدام از ۶ پادکست و ۶ کتاب صوتی فایل صوتی بارگذاری‌شده ندارند (src خالی است).",
        "authority_level": "ACADEMY_DERIVED"
      },
      "possible_explanation": "محتوای فعلی سایت احتمالاً داده‌ی نمونه/دمو است و فایل‌های صوتی هنوز آپلود نشده‌اند، یا محتوا در جای دیگری (کانال، پنل دانشجو) منتشر می‌شود.",
      "authority_decision": "",
      "status": "OPEN",
      "requires_human_review": true,
      "review_priority": "P1",
      "impact": "تا روشن شدن این موضوع، مربی هوش مصنوعی نباید به دانشجو بگوید فلان پادکست در سایت قابل پخش است و نباید آمار حجم محتوا را تأیید کند.",
      "created_at": "2026-09-05T15:45:00Z",
      "updated_at": "2026-09-05T15:45:00Z"
    },
    {
      "id": "CONF-0002",
      "topic": "دو فهرست متفاوت از «سه اصل بازار» در جلسه‌ی اول دوره‌ی مقدماتی",
      "domain": "academy",
      "side_a": {
        "object_id_or_source": "ACA-INT-0007 (بخش ۷ جلسه‌ی اول)",
        "statement": "سه اصل: کانال قیمتی، نحوه‌ی نقدینگی‌ها و انتشار نقدینگی، خرید و فروش در سایکل.",
        "authority_level": "ACADEMY_PRIMARY"
      },
      "side_b": {
        "object_id_or_source": "ACA-INT-0006 (بخش ۲۱ جلسه‌ی اول)",
        "statement": "سه اصل: اسپایک، کانال قیمتی، تریدینگ رنج.",
        "authority_level": "ACADEMY_PRIMARY"
      },
      "possible_explanation": "احتمالاً دو موضوع متفاوت‌اند: یکی ساختار حرکت قیمت (اسپایک، کانال، رنج) و دیگری مبانی نگاه به بازار (تکرار، نقدینگی، سایکل). احتمال اشتباه بیانی یا خطای ترنسکریپت هم منتفی نیست.",
      "authority_decision": "",
      "status": "OPEN",
      "requires_human_review": true,
      "review_priority": "P1",
      "impact": "تا تعیین تکلیف، مربی نباید یکی از این دو فهرست را به‌عنوان «سه اصل بازار آکادمی» قطعی اعلام کند.",
      "created_at": "2026-09-05T15:45:00Z",
      "updated_at": "2026-09-05T15:45:00Z"
    },
    {
      "id": "CONF-0003",
      "topic": "الزام یا عدم الزام فیلترشکن در دوره‌ی مقدماتی",
      "domain": "academy",
      "side_a": {
        "object_id_or_source": "ACA-INT-0039 (جلسه ۲، بخش ۱۴)",
        "statement": "«اصلاً ملزم به اینترنت فیلتر نیست» و برخلاف ارز دیجیتال، IP ثابت لازم نیست.",
        "authority_level": "ACADEMY_PRIMARY"
      },
      "side_b": {
        "object_id_or_source": "ACA-INT-0078 (جلسه ۴، بخش ۱۰)",
        "statement": "«شما فیلترشکن باید فعال باشه» برای ورود به سایت بروکر.",
        "authority_level": "ACADEMY_PRIMARY"
      },
      "possible_explanation": "به‌احتمال زیاد دو موقعیت متفاوت‌اند: اتصال پلتفرم متاتریدر به سرور بروکر نیازی به فیلترشکن ندارد، اما باز کردن وب‌سایت و کابین بروکر ممکن است نیاز داشته باشد. تفکیک این دو در پاسخ به دانشجو ضروری است.",
      "authority_decision": "",
      "status": "OPEN",
      "requires_human_review": true,
      "review_priority": "P2",
      "impact": "پاسخ مربی باید تفکیک کند: برای سایت بروکر ممکن است لازم باشد، برای اتصال متاتریدر خیر. تا تأیید، هر دو بیان حفظ می‌شوند.",
      "created_at": "2026-09-05T15:45:00Z",
      "updated_at": "2026-09-05T15:45:00Z"
    }
  ]
}
