{
  "collection_id": "academy_tools",
  "domain": "academy",
  "title": "ابزارهای رسمی آکادمی",
  "description": "ابزارهایی که خود آکادمی منتشر کرده است.",
  "version": "v001",
  "generated_at": "2026-09-05T20:50:22Z",
  "pipeline_stage": "STRUCTURED",
  "source_files": [
    "raw_sources/mentor_qa/mentor_qa_2026_08_27.md"
  ],
  "notes": [
    "این ابزارها با محصولات بیرونی که ACA-RULE-0002 آن‌ها را رد می‌کند یکی نیستند (CONF-0005)."
  ],
  "objects": [
    {
      "id": "ACA-OPS-0004",
      "object_type": "OPERATIONAL_FACT",
      "domain": "academy",
      "category": "ابزارهای آکادمی",
      "title": "اکسپرت SSProX — ابزار رایگان مدیریت سرمایه و معاملات آکادمی",
      "language": "fa",
      "summary": "ابزار رایگان خود آکادمی برای محاسبه‌ی خودکار حجم بر اساس ریسک، روی متاتریدر ۴ و ۵.",
      "chunk_text": "آکادمی اکسپرت **SSProX** را به‌صورت رسمی و **کاملاً رایگان** منتشر کرده است. کاری که می‌کند: در کسری از ثانیه حجم معامله را بر اساس میزان ریسکی که خودتان تعیین کرده‌اید محاسبه می‌کند. امکاناتی که در اعلان رسمی برشمرده شده:\n• محاسبه‌ی خودکار حجم بر اساس ریسک\n• افزایش سرعت و دقت در اجرای معاملات\n• مدیریت آسان‌تر حد سود و حد ضرر\n• کاهش خطاهای ناشی از محاسبات دستی\n• ست کردن TP2 و نمایش اسپرد\nروی متاتریدر ۴ و ۵ اجرا می‌شود و ویدیوی آموزشی جداگانه دارد.\nنحوه‌ی کار (از پاسخ منتور، `MQA-00037`): شما حجم را دستی وارد نمی‌کنید — فقط ریسک‌لاین را مشخص می‌کنید و ابزار بر اساس فاصله‌ی حد ضرر، حجم را خودش تعیین می‌کند.\n✅ وضعیت سیاستی (حل‌شده): متن `ACA-RULE-0002` با تصمیم `D-0014` اصلاح شد و به محصولات **بیرونی** محدود گردید؛ ابزارهای رسمی خود آکادمی مانند SSProX از آن مستثنا هستند. مربی درباره‌ی عملکرد آن توضیح می‌دهد و نصب، راه‌اندازی و لایسنس را به پشتیبانی ارجاع می‌دهد.",
      "source": {
        "source_type": "ACADEMY_DOCUMENT",
        "source_ref": "raw_sources/mentor_qa/mentor_qa_2026_08_27.md",
        "source_location": "اعلان کانال آکادمی، ۲۷ آگوست ۲۰۲۶",
        "author": "آکادمی سبحان صمدی",
        "verbatim_quote": "اكسپرت SSProX رونمايى شد🚀 ابزار هوشمند مدیریت سرمایه و معاملات (كاملاً رايگان) … در کسری از ثانیه حجم معامله را بر اساس میزان ریسک تعیین‌شده توسط شما محاسبه می‌کند … اجرا در: MT5 / MT4"
      },
      "authority_level": "ACADEMY_PRIMARY",
      "methodology_scope": "ACADEMY_OPERATIONS",
      "platform_scope": "BOTH",
      "approval_status": "PENDING_REVIEW",
      "lifecycle_status": "PENDING_REVIEW",
      "verification_required": true,
      "verification_note": "اعلان کانال؛ پیش از پاسخ رسمی، تأیید نسخه و شرایط انتشار لازم است.",
      "confidence": 0.85,
      "version": "v001",
      "conflicts": [
        "CONF-0005"
      ],
      "warnings": [
        "مربی فقط توضیح عملکردی می‌دهد و هیچ اکسپرت بیرونی را پیشنهاد نمی‌کند.",
        "نصب و راه‌اندازی و مسائل لایسنس به پشتیبانی انسانی ارجاع می‌شود."
      ],
      "keywords": [
        "SSProX",
        "اکسپرت",
        "مدیریت سرمایه",
        "ریسک لاین",
        "رایگان",
        "TP2"
      ],
      "related_concepts": [
        "MQA-00037",
        "ACA-RULE-0002",
        "ACA-INT-0172"
      ],
      "related_questions": [
        "SSProX چیه؟",
        "اکسپرت مدیریت سرمایه رو از کجا بگیرم؟",
        "اکسپرت آکادمی رایگانه؟"
      ],
      "created_at": "2026-09-05T20:50:22Z",
      "updated_at": "2026-09-05T20:50:22Z"
    }
  ]
}
