{
  "collection_id": "conflict_registry",
  "domain": "meta",
  "title": "دفتر ثبت تعارض‌ها",
  "description": "تعارض‌های کشف‌شده بین منابع. هیچ تعارضی با حدس حل نمی‌شود.",
  "version": "v001",
  "generated_at": "2026-09-05T20:50:22Z",
  "pipeline_stage": "VALIDATED",
  "source_files": [
    "index.html",
    "js/data.js"
  ],
  "notes": [
    "تعارض‌های مربوط به متدولوژی، پس از دریافت محتوای دوره‌ها اضافه خواهند شد."
  ],
  "objects": [
    {
      "id": "CONF-0001",
      "topic": "حجم واقعی محتوای صوتی منتشرشده‌ی آکادمی",
      "domain": "academy",
      "side_a": {
        "object_id_or_source": "index.html:64 (آمار سایت)",
        "statement": "سایت آکادمی «+۸۰ ساعت محتوا» را اعلام می‌کند.",
        "authority_level": "ACADEMY_DERIVED"
      },
      "side_b": {
        "object_id_or_source": "js/data.js (window.SSAData.podcasts[*].src و books[*].src)",
        "statement": "هیچ‌کدام از ۶ پادکست و ۶ کتاب صوتی فایل صوتی بارگذاری‌شده ندارند (src خالی است).",
        "authority_level": "ACADEMY_DERIVED"
      },
      "possible_explanation": "محتوای فعلی سایت احتمالاً داده‌ی نمونه/دمو است و فایل‌های صوتی هنوز آپلود نشده‌اند، یا محتوا در جای دیگری (کانال، پنل دانشجو) منتشر می‌شود.",
      "authority_decision": "",
      "status": "OPEN",
      "requires_human_review": true,
      "review_priority": "P1",
      "impact": "تا روشن شدن این موضوع، مربی هوش مصنوعی نباید به دانشجو بگوید فلان پادکست در سایت قابل پخش است و نباید آمار حجم محتوا را تأیید کند.",
      "created_at": "2026-09-05T20:50:22Z",
      "updated_at": "2026-09-05T20:50:22Z"
    },
    {
      "id": "CONF-0002",
      "topic": "دو فهرست متفاوت از «سه اصل بازار» در جلسه‌ی اول دوره‌ی مقدماتی",
      "domain": "academy",
      "side_a": {
        "object_id_or_source": "ACA-INT-0007 (بخش ۷ جلسه‌ی اول)",
        "statement": "سه اصل: کانال قیمتی، نحوه‌ی نقدینگی‌ها و انتشار نقدینگی، خرید و فروش در سایکل.",
        "authority_level": "ACADEMY_PRIMARY"
      },
      "side_b": {
        "object_id_or_source": "ACA-INT-0006 (بخش ۲۱ جلسه‌ی اول)",
        "statement": "سه اصل: اسپایک، کانال قیمتی، تریدینگ رنج.",
        "authority_level": "ACADEMY_PRIMARY"
      },
      "possible_explanation": "احتمالاً دو موضوع متفاوت‌اند: یکی ساختار حرکت قیمت (اسپایک، کانال، رنج) و دیگری مبانی نگاه به بازار (تکرار، نقدینگی، سایکل). احتمال اشتباه بیانی یا خطای ترنسکریپت هم منتفی نیست. شاهد تازه: جلسه‌ی ۱۱ (ACA-INT-0179) «اسپایک، کانال قیمتی، تریدینگ رنج» را صریحاً ذیل «ماهیت مارکت (ساختار)» می‌آورد، جلسه‌ی ۱۲ (ACA-INT-0191) همان سه مورد را به‌عنوان «سه چرخه‌ی اصلی بازار» با روش معامله‌ی هرکدام تعریف می‌کند، و جلسه‌ی ۱۳ (ACA-INT-0202) ترتیب و نقش آن‌ها را می‌دهد (اسپایک شروع‌کننده، کانال پس از اولین اصلاح، رنج چرخه‌ی آخر). سه شاهد مستقل به نفع تفکیک دو موضوع است، اما تصمیم نهایی با مالک پروژه است.",
      "authority_decision": "مالک پروژه فهرست دوم را تأیید کرد (D-0005): «سه اصل / سه چرخه‌ی بازار» عبارت‌اند از اسپایک، کانال قیمتی و تریدینگ رنج. فهرست دیگر حذف نشد اما دیگر با این عنوان ارائه نمی‌شود (ACA-INT-0007 بازعنوان‌گذاری شد).",
      "status": "RESOLVED",
      "requires_human_review": false,
      "review_priority": "P1",
      "impact": "پاسخ واحد در رکورد تأییدشده‌ی ACA-CLR-0002 ثبت شد و بر نقل‌قول‌های جلسه‌ی اول اولویت دارد.",
      "created_at": "2026-09-05T20:50:22Z",
      "updated_at": "2026-09-05T20:50:22Z"
    },
    {
      "id": "CONF-0005",
      "topic": "وجود اکسپرت داخلی آکادمی در برابر متن قاعده‌ی «هیچ اکسپرتی پیشنهاد نمی‌شود»",
      "domain": "academy",
      "side_a": {
        "object_id_or_source": "ACA-RULE-0002 (تصمیم D-0002)",
        "statement": "آکادمی هیچ اکسپرت، ربات، سیگنال یا کپی‌تریدینگی را معرفی، تأیید یا پیشنهاد نمی‌کند.",
        "authority_level": "ACADEMY_DERIVED"
      },
      "side_b": {
        "object_id_or_source": "MQA-00037 (پاسخ منتور، بسته‌ی ۱)",
        "statement": "آکادمی اکسپرت مدیریت سرمایه‌ی خودش را دارد و منتور درباره‌ی نحوه‌ی کار آن پاسخ می‌دهد. شاهد قطعی: در ۲۷ آگوست ۲۰۲۶ اکسپرت SSProX به‌صورت رسمی و کاملاً رایگان در کانال آکادمی رونمایی شد (ACA-OPS-0004).",
        "authority_level": "MENTOR_VERIFIED"
      },
      "possible_explanation": "تعارض واقعی نبود: قاعده‌ی D-0002 ناظر بر محصولات بیرونی بود و ابزار مدیریت سرمایه‌ی خود آکادمی موضوع دیگری است؛ فقط متن قاعده این تفکیک را نداشت.",
      "authority_decision": "مالک پروژه اصلاح متن را تأیید کرد (D-0014): قاعده به محصولات «بیرونی» محدود شد و ابزارهای رسمی خود آکادمی — مانند SSProX — از آن مستثنا شدند. مربی درباره‌ی عملکرد ابزار آکادمی توضیح می‌دهد و نصب و لایسنس را به پشتیبانی ارجاع می‌دهد.",
      "status": "RESOLVED",
      "requires_human_review": false,
      "review_priority": "P1",
      "impact": "متن ACA-RULE-0002 اصلاح شد و ACA-OPS-0004 به‌عنوان ابزار رسمی آکادمی ثبت است.",
      "created_at": "2026-09-05T20:50:22Z",
      "updated_at": "2026-09-05T20:50:22Z"
    },
    {
      "id": "CONF-0006",
      "topic": "سه روایت متفاوت از مسیر بک‌تست و استراتژی‌نویسی در پاسخ‌های منتورها",
      "domain": "academy",
      "side_a": {
        "object_id_or_source": "MQA-00023 (قالب استاندارد، بسته‌ی ۱)",
        "statement": "۱۰ تا ۱۵ استراتژی؛ یک سال بک‌تست در سه بازه‌ی چهارماهه؛ حذف تدریجی استراتژی‌ها و سشن‌های ضعیف تا رسیدن به یک سشن.",
        "authority_level": "MENTOR_VERIFIED"
      },
      "side_b": {
        "object_id_or_source": "بسته‌ی ۲ — دو روایت متفاوت",
        "statement": "روایت دوم: چندین استراتژی، سه ماه بک‌تست، حذف تا رسیدن به ۱ یا ۲ استراتژی، سپس همان‌ها تا یک سال. روایت سوم: ۱۰ استراتژی، چهار ماه اول، انتخاب ۵ تا، چهار ماه دوم با سشن‌های مختلف، چهار ماه پایانی فقط سشن و استراتژی برتر.",
        "authority_level": "MENTOR_VERIFIED"
      },
      "possible_explanation": "احتمالاً هر سه روایت شرح‌های ساده‌شده‌ی همان فرایند ویدیوهای استراتژی‌نویسی‌اند و منتورهای مختلف آن را متفاوت خلاصه می‌کنند. اما تعداد استراتژی‌ها، طول هر مرحله و اینکه سشن‌ها کی وارد می‌شوند در سه روایت یکی نیست، و دانشجوها هرکدام طبق روایتی که شنیده‌اند پیش می‌روند. بسته‌ی سوم روایت چهارمی هم افزود (MQA-00076): استراتژی‌ها بر مبنای سه چرخه‌ی بازار نوشته شوند و «حداقل ۱۰ مورد» باشند — که با تعداد روایت‌های قبلی هم‌خوان نیست.",
      "authority_decision": "مالک پروژه روایت الف (قالب رسمی) را تأیید کرد (D-0012): ۱۰ تا ۱۵ استراتژی و یک سال بک‌تست در سه بازه‌ی چهارماهه با حذف تدریجی تا یک سشن. بقیه‌ی روایت‌ها خلاصه‌های ناقص همین مسیرند.",
      "status": "RESOLVED",
      "requires_human_review": false,
      "review_priority": "P0",
      "impact": "پاسخ واحد در رکورد تأییدشده‌ی ACA-CLR-0004 ثبت شد و بر همه‌ی روایت‌های دیگر اولویت دارد.",
      "created_at": "2026-09-05T20:50:22Z",
      "updated_at": "2026-09-05T20:50:22Z"
    },
    {
      "id": "CONF-0003",
      "topic": "الزام یا عدم الزام فیلترشکن در دوره‌ی مقدماتی",
      "domain": "academy",
      "side_a": {
        "object_id_or_source": "ACA-INT-0039 (جلسه ۲، بخش ۱۴)",
        "statement": "«اصلاً ملزم به اینترنت فیلتر نیست» و برخلاف ارز دیجیتال، IP ثابت لازم نیست.",
        "authority_level": "ACADEMY_PRIMARY"
      },
      "side_b": {
        "object_id_or_source": "ACA-INT-0078 (جلسه ۴، بخش ۱۰)",
        "statement": "«شما فیلترشکن باید فعال باشه» برای ورود به سایت بروکر.",
        "authority_level": "ACADEMY_PRIMARY"
      },
      "possible_explanation": "دو موقعیت متفاوت‌اند: اتصال پلتفرم متاتریدر به سرور بروکر نیازی به فیلترشکن ندارد، اما باز کردن وب‌سایت و کابین بروکر ممکن است نیاز داشته باشد.",
      "authority_decision": "تأییدشده توسط مالک پروژه (تصمیم D-0003): هر دو بیان درست‌اند و ناظر بر دو موقعیت متفاوت. سایت و کابین بروکر ممکن است فیلترشکن بخواهد؛ اتصال متاتریدر و انجام معامله نمی‌خواهد. پاسخ یکپارچه در ACA-CLR-0001 ثبت شد.",
      "status": "RESOLVED",
      "requires_human_review": false,
      "review_priority": "P3",
      "impact": "حل شد. مربی باید همیشه دو موقعیت را تفکیک کند و هرگز نگوید برای ترید کردن فیلترشکن لازم است.",
      "created_at": "2026-09-05T20:50:22Z",
      "updated_at": "2026-09-05T20:50:22Z"
    },
    {
      "id": "CONF-0004",
      "topic": "کارکرد گزینه‌ی Open Offline در متاتریدر ۴",
      "domain": "academy",
      "side_a": {
        "object_id_or_source": "ACA-INT-0109 (دوره مقدماتی، جلسه ۵، بخش ۱۶)",
        "statement": "Open Offline یعنی باز کردن نمودار آفلاین «برای وقتی نت قطع هست».",
        "authority_level": "ACADEMY_PRIMARY"
      },
      "side_b": {
        "object_id_or_source": "دانش عمومی پلتفرم (رکورد MT4-PROC-0009، بعداً حذف شد)",
        "statement": "چارت آفلاین برای نمایش تایم‌فریم‌های غیراستاندارد یا نمودارهای ساخته‌شده توسط اسکریپت و اکسپرت است و به‌صورت خودکار با قیمت زنده به‌روز نمی‌شود؛ راهی برای ادامه‌ی معامله هنگام قطع اینترنت نیست.",
        "authority_level": "GENERAL_KNOWLEDGE"
      },
      "possible_explanation": "ساده‌سازی بیانی در کلاس یا خطای ترنسکریپت. این مورد یک واقعیت فنی پلتفرم است، نه متدولوژی آکادمی.",
      "authority_decision": "تصمیم مالک پروژه (D-0004): این جمله حذف شود. رکورد ACA-INT-0109 از پایگاه دانش برداشته شد و هیچ دانشی از آن ساخته نمی‌شود. جمله‌ی اصلی فقط در ترنسکریپت خام باقی است.",
      "status": "RESOLVED",
      "requires_human_review": false,
      "review_priority": "P3",
      "impact": "حل شد. طبق تصمیم D-0004، موضوع چارت آفلاین به‌طور کامل از پایگاه دانش برداشته شد: هم رکورد دوره (ACA-INT-0109) و هم رکورد لایه‌ی پلتفرم (MT4-PROC-0009). مربی درباره‌ی این قابلیت پاسخی ارائه نمی‌کند.",
      "created_at": "2026-09-05T20:50:22Z",
      "updated_at": "2026-09-05T20:50:22Z"
    }
  ]
}
