{
  "collection_id": "conflict_registry",
  "domain": "meta",
  "title": "دفتر ثبت تعارض‌ها",
  "description": "تعارض‌های کشف‌شده بین منابع. هیچ تعارضی با حدس حل نمی‌شود.",
  "version": "v001",
  "generated_at": "2026-09-05T15:58:30Z",
  "pipeline_stage": "VALIDATED",
  "source_files": [
    "index.html",
    "js/data.js"
  ],
  "notes": [
    "تعارض‌های مربوط به متدولوژی، پس از دریافت محتوای دوره‌ها اضافه خواهند شد."
  ],
  "objects": [
    {
      "id": "CONF-0001",
      "topic": "حجم واقعی محتوای صوتی منتشرشده‌ی آکادمی",
      "domain": "academy",
      "side_a": {
        "object_id_or_source": "index.html:64 (آمار سایت)",
        "statement": "سایت آکادمی «+۸۰ ساعت محتوا» را اعلام می‌کند.",
        "authority_level": "ACADEMY_DERIVED"
      },
      "side_b": {
        "object_id_or_source": "js/data.js (window.SSAData.podcasts[*].src و books[*].src)",
        "statement": "هیچ‌کدام از ۶ پادکست و ۶ کتاب صوتی فایل صوتی بارگذاری‌شده ندارند (src خالی است).",
        "authority_level": "ACADEMY_DERIVED"
      },
      "possible_explanation": "محتوای فعلی سایت احتمالاً داده‌ی نمونه/دمو است و فایل‌های صوتی هنوز آپلود نشده‌اند، یا محتوا در جای دیگری (کانال، پنل دانشجو) منتشر می‌شود.",
      "authority_decision": "",
      "status": "OPEN",
      "requires_human_review": true,
      "review_priority": "P1",
      "impact": "تا روشن شدن این موضوع، مربی هوش مصنوعی نباید به دانشجو بگوید فلان پادکست در سایت قابل پخش است و نباید آمار حجم محتوا را تأیید کند.",
      "created_at": "2026-09-05T15:58:30Z",
      "updated_at": "2026-09-05T15:58:30Z"
    },
    {
      "id": "CONF-0002",
      "topic": "دو فهرست متفاوت از «سه اصل بازار» در جلسه‌ی اول دوره‌ی مقدماتی",
      "domain": "academy",
      "side_a": {
        "object_id_or_source": "ACA-INT-0007 (بخش ۷ جلسه‌ی اول)",
        "statement": "سه اصل: کانال قیمتی، نحوه‌ی نقدینگی‌ها و انتشار نقدینگی، خرید و فروش در سایکل.",
        "authority_level": "ACADEMY_PRIMARY"
      },
      "side_b": {
        "object_id_or_source": "ACA-INT-0006 (بخش ۲۱ جلسه‌ی اول)",
        "statement": "سه اصل: اسپایک، کانال قیمتی، تریدینگ رنج.",
        "authority_level": "ACADEMY_PRIMARY"
      },
      "possible_explanation": "احتمالاً دو موضوع متفاوت‌اند: یکی ساختار حرکت قیمت (اسپایک، کانال، رنج) و دیگری مبانی نگاه به بازار (تکرار، نقدینگی، سایکل). احتمال اشتباه بیانی یا خطای ترنسکریپت هم منتفی نیست.",
      "authority_decision": "",
      "status": "OPEN",
      "requires_human_review": true,
      "review_priority": "P1",
      "impact": "تا تعیین تکلیف، مربی نباید یکی از این دو فهرست را به‌عنوان «سه اصل بازار آکادمی» قطعی اعلام کند.",
      "created_at": "2026-09-05T15:58:30Z",
      "updated_at": "2026-09-05T15:58:30Z"
    },
    {
      "id": "CONF-0003",
      "topic": "الزام یا عدم الزام فیلترشکن در دوره‌ی مقدماتی",
      "domain": "academy",
      "side_a": {
        "object_id_or_source": "ACA-INT-0039 (جلسه ۲، بخش ۱۴)",
        "statement": "«اصلاً ملزم به اینترنت فیلتر نیست» و برخلاف ارز دیجیتال، IP ثابت لازم نیست.",
        "authority_level": "ACADEMY_PRIMARY"
      },
      "side_b": {
        "object_id_or_source": "ACA-INT-0078 (جلسه ۴، بخش ۱۰)",
        "statement": "«شما فیلترشکن باید فعال باشه» برای ورود به سایت بروکر.",
        "authority_level": "ACADEMY_PRIMARY"
      },
      "possible_explanation": "دو موقعیت متفاوت‌اند: اتصال پلتفرم متاتریدر به سرور بروکر نیازی به فیلترشکن ندارد، اما باز کردن وب‌سایت و کابین بروکر ممکن است نیاز داشته باشد.",
      "authority_decision": "تأییدشده توسط مالک پروژه (تصمیم D-0003): هر دو بیان درست‌اند و ناظر بر دو موقعیت متفاوت. سایت و کابین بروکر ممکن است فیلترشکن بخواهد؛ اتصال متاتریدر و انجام معامله نمی‌خواهد. پاسخ یکپارچه در ACA-CLR-0001 ثبت شد.",
      "status": "RESOLVED",
      "requires_human_review": false,
      "review_priority": "P3",
      "impact": "حل شد. مربی باید همیشه دو موقعیت را تفکیک کند و هرگز نگوید برای ترید کردن فیلترشکن لازم است.",
      "created_at": "2026-09-05T15:58:30Z",
      "updated_at": "2026-09-05T15:58:30Z"
    },
    {
      "id": "CONF-0004",
      "topic": "کارکرد گزینه‌ی Open Offline در متاتریدر ۴",
      "domain": "academy",
      "side_a": {
        "object_id_or_source": "ACA-INT-0109 (دوره مقدماتی، جلسه ۵، بخش ۱۶)",
        "statement": "Open Offline یعنی باز کردن نمودار آفلاین «برای وقتی نت قطع هست».",
        "authority_level": "ACADEMY_PRIMARY"
      },
      "side_b": {
        "object_id_or_source": "MT4-PROC-0009 (دانش پلتفرم)",
        "statement": "چارت آفلاین برای نمایش تایم‌فریم‌های غیراستاندارد یا نمودارهای ساخته‌شده توسط اسکریپت و اکسپرت است و به‌صورت خودکار با قیمت زنده به‌روز نمی‌شود؛ راهی برای ادامه‌ی معامله هنگام قطع اینترنت نیست.",
        "authority_level": "GENERAL_KNOWLEDGE"
      },
      "possible_explanation": "احتمالاً ساده‌سازی بیانی در کلاس یا خطای ترنسکریپت است. این مورد یک واقعیت فنی پلتفرم است، نه متدولوژی آکادمی؛ بنابراین مرجعیت آکادمی در اینجا موضوعیت ندارد و باید با رفتار واقعی متاتریدر سنجیده شود.",
      "authority_decision": "",
      "status": "OPEN",
      "requires_human_review": true,
      "review_priority": "P2",
      "impact": "تا تعیین تکلیف، مربی نباید به دانشجو بگوید با قطع اینترنت می‌تواند از چارت آفلاین استفاده کند؛ چون ممکن است دانشجو تصور کند معامله‌اش همچنان مدیریت می‌شود.",
      "created_at": "2026-09-05T15:58:30Z",
      "updated_at": "2026-09-05T15:58:30Z"
    }
  ]
}
