{
  "collection_id": "academy_recommended_broker",
  "domain": "brokers",
  "title": "بروکر معرفی‌شده‌ی آکادمی",
  "description": "اطلاعات بروکری که آکادمی در دوره معرفی می‌کند. همه‌ی ادعاها نقل‌شده از درس‌اند و تا راستی‌آزمایی با مستندات رسمی بروکر، تأییدشده محسوب نمی‌شوند.",
  "version": "v001",
  "generated_at": "2026-09-05T15:44:22Z",
  "pipeline_stage": "STRUCTURED",
  "source_files": [
    "raw_sources/academy/intro/intro_lesson_04.md"
  ],
  "notes": [
    "این نخستین رکورد لایه‌ی بروکر است.",
    "هیچ عدد معاملاتی (اسپرد، کمیسیون، سواپ، اهرم) هنوز ثبت نشده است — نیازمند مستندات بروکر (RQ-0004)."
  ],
  "objects": [
    {
      "id": "BRK-FACT-0001",
      "object_type": "BROKER_RULE",
      "domain": "brokers",
      "category": "بروکر معرفی‌شده‌ی آکادمی",
      "title": "بروکر معرفی‌شده‌ی آکادمی: WM Market",
      "language": "fa",
      "chunk_text": "بروکری که آکادمی سبحان صمدی معرفی می‌کند WM Market (دبلیو‌مارکت) است. اظهارات مدرس درباره‌ی آن: بیش از چهار سال است که خودش با این بروکر کار می‌کند و راضی بوده؛ به کاربران ایرانی خدمات می‌دهد؛ تحت نظارت MISA و دارای رگوله‌ی کومور (کاموریس) است؛ حساب‌ها بیمه هستند؛ اسپرد مناسبی دارد و در زمان اخبار عملکرد قابل قبولی دارد. سرور دمو در متاتریدر با نام «WM Market Demo» جست‌وجو می‌شود. ⚠️ همه‌ی این موارد اظهارات مدرس در زمان ضبط درس است. اعتبار سطح رگوله، بیمه بودن حساب‌ها و شرایط معاملاتی باید پیش از هر پاسخ رسمی از مستندات خود بروکر راستی‌آزمایی شود؛ مربی نباید «حساب شما بیمه است» را به‌عنوان واقعیت تأییدشده به دانشجو بگوید.",
      "broker": "WM Market (دبلیو‌مارکت)",
      "source": {
        "source_type": "ACADEMY_COURSE_TRANSCRIPT",
        "source_ref": "raw_sources/academy/intro/intro_lesson_04.md",
        "source_location": "بخش ۷ و ۱۰",
        "course": "دوره مقدماتی — معاملگری حرکات قیمت",
        "lesson": "۴",
        "author": "سبحان صمدی",
        "verbatim_quote": "شما در حال ثبت‌نام در دبلیو‌مارکت هستید که تحت نظارت سازمان خدمات بین‌المللی … MISA رگوله و داره مجوزه … حساب‌ها بیمه هستش. رگوله کاموریس هم داره. … من بیش از چهار سال در این بروکر فعال هستم."
      },
      "authority_level": "ACADEMY_PRIMARY",
      "methodology_scope": "BROKER_SPECIFIC",
      "platform_scope": "MT4_ONLY",
      "approval_status": "REVIEW_REQUIRED",
      "lifecycle_status": "PENDING_REVIEW",
      "verification_required": true,
      "verification_note": "ادعاهای مربوط به رگوله، بیمه‌ی حساب و شرایط معاملاتی از خود درس نقل شده و راستی‌آزمایی نشده‌اند. اعتبار نهادهای ناظر یکسان نیست و این ادعاها می‌تواند مبنای تصمیم مالی دانشجو قرار بگیرد؛ بنابراین تا دریافت مستندات رسمی بروکر (RQ-0004) به‌عنوان واقعیت تأییدشده ارائه نمی‌شود.",
      "review_priority": "P1",
      "review_reason": "نیازمند مستندات رسمی بروکر و تأیید آکادمی درباره‌ی نحوه‌ی بیان این ادعاها به دانشجو.",
      "warnings": [
        "سطح اعتبار رگوله‌ها یکسان نیست؛ عبارت «رگوله دارد» به‌تنهایی سطح نظارت را مشخص نمی‌کند.",
        "ادعای بیمه بودن حساب‌ها باید از مستندات رسمی بروکر تأیید شود.",
        "شرایط بروکر با گذشت زمان تغییر می‌کند؛ اعداد و شرایط باید در زمان پاسخ‌گویی به‌روز باشد."
      ],
      "validity": {
        "as_of": "زمان ضبط دوره‌ی مقدماتی",
        "time_sensitive": true,
        "verified_against_broker_docs": false,
        "claims": [
          "رگوله MISA",
          "رگوله کومور",
          "بیمه بودن حساب‌ها",
          "خدمات به کاربران ایرانی",
          "سابقه‌ی بیش از چهار ساله‌ی استفاده توسط مدرس"
        ]
      },
      "confidence": 0.6,
      "version": "v001",
      "keywords": [
        "WM Market",
        "دبلیو مارکت",
        "بروکر آکادمی",
        "MISA",
        "رگوله",
        "کومور"
      ],
      "related_concepts": [
        "ACA-INT-0071",
        "ACA-INT-0072",
        "ACA-INT-0074"
      ],
      "related_questions": [
        "با چه بروکری کار کنم؟",
        "بروکر پیشنهادی آکادمی چیه؟",
        "WM Market خوبه؟",
        "حسابم بیمه‌ست؟"
      ],
      "created_at": "2026-09-05T15:44:22Z",
      "updated_at": "2026-09-05T15:44:22Z"
    }
  ]
}
