{
  "collection_id": "review_queue_open_items",
  "domain": "meta",
  "title": "صف بازبینی انسانی",
  "description": "مواردی که برای ادامه‌ی کار به تصمیم یا داده‌ی انسانی نیاز دارند.",
  "version": "v001",
  "generated_at": "2026-09-05T12:13:09Z",
  "pipeline_stage": "VALIDATED",
  "source_files": [
    "MENTORAI_KB_AUDIT.md"
  ],
  "notes": [
    "اولویت P0 یعنی کار بدون آن متوقف می‌شود."
  ],
  "objects": [
    {
      "id": "RQ-0001",
      "title": "محتوای دوره‌های آکادمی در مخزن موجود نیست",
      "domain": "academy",
      "object_ids": [],
      "reason": "مخزن فقط شامل وب‌سایت آکادمی است؛ هیچ ترنسکریپت، جزوه یا سند متدولوژی وجود ندارد.",
      "question_for_human": "محتوای دوره‌ی مقدماتی و پیشرفته را در چه قالبی و از چه مسیری در اختیار پروژه می‌گذارید؟",
      "options": [
        "آپلود فایل‌های متنی/زیرنویس در raw_sources/academy/",
        "آپلود فایل صوتی و انجام تبدیل گفتار به متن در همین پروژه",
        "دسترسی به پنل دانشجویی برای استخراج محتوا"
      ],
      "recommendation": "فایل‌های متنی یا زیرنویس (SRT/VTT/DOCX) در raw_sources/academy/ قرار بگیرد؛ سریع‌ترین و دقیق‌ترین مسیر است.",
      "priority": "P0",
      "status": "OPEN",
      "created_at": "2026-09-05T12:13:09Z",
      "updated_at": "2026-09-05T12:13:09Z"
    },
    {
      "id": "RQ-0002",
      "title": "دیتاست پرسش و پاسخ منتور موجود نیست",
      "domain": "mentor_qa",
      "object_ids": [],
      "reason": "بدون گفت‌وگوهای واقعی دانشجو و منتور، لایه‌ی MENTOR_QA قابل ساخت نیست.",
      "question_for_human": "خروجی گفت‌وگوهای دانشجو-منتور از چه بستری و با چه قالبی قابل ارائه است؟",
      "options": [
        "خروجی JSON/CSV از تلگرام یا واتس‌اپ",
        "خروجی تیکت‌های پشتیبانی",
        "کپی دستی نمونه‌ی اولیه (۱۰۰ گفت‌وگو)"
      ],
      "recommendation": "ابتدا یک نمونه‌ی ۱۰۰ گفت‌وگویی برای اثبات خط پردازش، سپس خروجی کامل.",
      "priority": "P0",
      "status": "OPEN",
      "created_at": "2026-09-05T12:13:09Z",
      "updated_at": "2026-09-05T12:13:09Z"
    },
    {
      "id": "RQ-0003",
      "title": "دوره‌ی روان‌شناسی آکادمی دریافت نشده است",
      "domain": "psychology",
      "object_ids": [],
      "reason": "لایه‌ی روان‌شناسی فعلاً فقط دانش عمومی است و منبع اصلی آکادمی ندارد.",
      "question_for_human": "دوره‌ی روان‌شناسی آکادمی موجود است؟ در چه قالبی می‌توان آن را دریافت کرد؟",
      "options": [
        "فایل دوره موجود است و ارسال می‌شود",
        "دوره هنوز تولید نشده است"
      ],
      "recommendation": "تا زمان دریافت، لایه‌ی عمومی به‌عنوان موقت و PENDING_VERIFICATION باقی می‌ماند.",
      "priority": "P1",
      "status": "OPEN",
      "created_at": "2026-09-05T12:13:09Z",
      "updated_at": "2026-09-05T12:13:09Z"
    },
    {
      "id": "RQ-0004",
      "title": "بروکر یا بروکرهای مورد استفاده مشخص نیستند",
      "domain": "brokers",
      "object_ids": [],
      "reason": "دانش بروکر بدون نام بروکر و مستندات رسمی آن قابل تولید نیست و هرگز تعمیم داده نمی‌شود.",
      "question_for_human": "دانشجویان آکادمی عمدتاً با کدام بروکر(ها) کار می‌کنند و مستندات رسمی آن‌ها کجاست؟",
      "options": [
        "فهرست بروکرهای پیشنهادی آکادمی ارائه شود",
        "فقط دانش عمومی پلتفرم پوشش داده شود"
      ],
      "recommendation": "فهرست بروکرها + لینک یا فایل مشخصات نمادها؛ بدون آن، سؤال‌های «اسپرد چقدره؟» بی‌پاسخ می‌مانند.",
      "priority": "P1",
      "status": "OPEN",
      "created_at": "2026-09-05T12:13:09Z",
      "updated_at": "2026-09-05T12:13:09Z"
    },
    {
      "id": "RQ-0005",
      "title": "احتمال نمونه/دمو بودن محتوای سایت",
      "domain": "academy",
      "object_ids": [
        "ACA-CAT-0001",
        "CONF-0001"
      ],
      "reason": "هیچ فایل صوتی بارگذاری نشده و آمار بازدید و مدت‌زمان‌ها گرد و تأییدنشده‌اند.",
      "question_for_human": "آیا فهرست فعلی پادکست‌ها و کتاب‌ها واقعی است یا داده‌ی نمونه برای طراحی سایت؟",
      "options": [
        "واقعی است و فایل‌ها بعداً آپلود می‌شوند",
        "داده‌ی نمونه است و باید از پایگاه دانش حذف شود"
      ],
      "recommendation": "تا تعیین تکلیف، این رکوردها PENDING_REVIEW می‌مانند و مربی نباید آن‌ها را قطعی اعلام کند.",
      "priority": "P1",
      "status": "OPEN",
      "created_at": "2026-09-05T12:13:09Z",
      "updated_at": "2026-09-05T12:13:09Z"
    },
    {
      "id": "RQ-0006",
      "title": "شرایط و قیمت منتورینگ مشخص نیست",
      "domain": "academy",
      "object_ids": [
        "ACA-OPS-0002"
      ],
      "reason": "سایت فقط سرفصل خدمات منتورینگ را دارد؛ قیمت، مدت و شرایط ثبت‌نام موجود نیست.",
      "question_for_human": "قیمت، مدت دوره، ظرفیت و شرایط ثبت‌نام منتورینگ چیست؟",
      "options": [
        "اطلاعات ارائه شود تا وارد دانش عملیاتی شود",
        "مربی این سؤال‌ها را به پشتیبانی انسانی ارجاع دهد"
      ],
      "recommendation": "اگر قیمت متغیر است، بهتر است مربی همیشه به پشتیبانی انسانی ارجاع دهد.",
      "priority": "P1",
      "status": "OPEN",
      "created_at": "2026-09-05T12:13:09Z",
      "updated_at": "2026-09-05T12:13:09Z"
    },
    {
      "id": "RQ-0007",
      "title": "دانش متاتریدر بدون تأیید منبع رسمی",
      "domain": "metatrader",
      "object_ids": [],
      "reason": "محیط پردازش دسترسی شبکه ندارد و مستندات رسمی متاکوتس قابل واکشی نبود.",
      "question_for_human": "کدام مسیر برای تأیید دانش متاتریدر ترجیح داده می‌شود؟",
      "options": [
        "بازبینی انسانی توسط منتور",
        "قرار دادن نسخه‌ی آفلاین راهنمای متاکوتس در raw_sources/platform/",
        "فعال کردن دسترسی شبکه برای دامنه‌ی metaquotes در محیط پردازش"
      ],
      "recommendation": "قرار دادن راهنمای آفلاین در raw_sources/platform/؛ هم قابل ردیابی است و هم تکرارپذیر.",
      "priority": "P1",
      "status": "OPEN",
      "created_at": "2026-09-05T12:13:09Z",
      "updated_at": "2026-09-05T12:13:09Z"
    },
    {
      "id": "RQ-0008",
      "title": "متدولوژی رسمی آکادمی تعریف نشده است",
      "domain": "academy",
      "object_ids": [],
      "reason": "عنوان پادکست‌ها به «پرایس اکشن» و «تحلیل تکنیکال» اشاره دارد، اما هیچ سند رسمی متدولوژی وجود ندارد؛ بدون آن، مرز «آکادمی» و «دانش عمومی» قابل اجرا نیست.",
      "question_for_human": "متدولوژی رسمی آکادمی چیست و چه چیزهایی صراحتاً بیرون از آن است؟",
      "options": [
        "سند متدولوژی ارائه شود",
        "متدولوژی از دل ترنسکریپت دوره‌ها استخراج و برای تأیید ارسال شود"
      ],
      "recommendation": "استخراج پیش‌نویس متدولوژی از ترنسکریپت‌ها و تأیید نهایی توسط سبحان صمدی.",
      "priority": "P0",
      "status": "OPEN",
      "created_at": "2026-09-05T12:13:09Z",
      "updated_at": "2026-09-05T12:13:09Z"
    }
  ]
}
